show_id,type,title,director,cast,country,date_added,release_year,rating,duration,listed_in,description
s3952,TV Show,Mars,Everardo Gout,"Jihae, Alberto Ammann, Clémentine Poidatz, Anamaria Marinca, Sammi Rotibi, Nicholas Wittman, Cosima Shaw",United States,2019-11-01,2018,TV-PG,2 Seasons,"Docuseries, Science & Nature TV, TV Dramas",Fact meets fiction in this docudrama chronicling the journey of a spacecraft crew as it embarks in 2033 on a mission to colonize the red planet.
s6045,Movie,That Thing Called Tadhana,Antoinette Jadaone,"Angelica Panganiban, JM de Guzman",Philippines,2019-03-07,2015,TV-MA,91 min,"Dramas, International Movies, Romantic Movies","A devastating breakup with her boyfriend may be the start of a new beginning for Mace, thanks to an adventurous and kind stranger named Anthony."
s6396,Movie,The Girl from the Song,Ibai Abad,"Lewis Rainer, Josephine Berry, Charlotte Atkinson, Charles MacGechan",Spain,2017-11-24,2016,TV-MA,101 min,"Dramas, Independent Movies, International Movies","When an aspiring musician falls for a carefree college student, he follows her to the Nevada desert to declare his love to her and find himself."
s5581,Movie,Short Term 12,Destin Daniel Cretton,"Brie Larson, John Gallagher Jr., Kaitlyn Dever, Rami Malek, Lakeith Stanfield, Kevin Hernandez, Melora Walters, Stephanie Beatriz, Lydia Du Veaux, Alex Calloway, Frantz Turner",United States,2019-07-18,2013,R,97 min,"Dramas, Independent Movies","A new charge at a foster care facility dredges up the memories of a young supervisor's own troubled past, and her tough exterior begins eroding."
s5441,Movie,Scott Pilgrim vs. the World,Edgar Wright,"Michael Cera, Mary Elizabeth Winstead, Kieran Culkin, Chris Evans, Anna Kendrick, Brie Larson, Alison Pill, Aubrey Plaza, Brandon Routh, Jason Schwartzman, Mark Webber, Mae Whitman, Johnny Simmons, Ellen Wong","United States, United Kingdom, Canada, Japan",2018-09-16,2010,PG-13,112 min,"Action & Adventure, Comedies, Cult Movies","Dreamy delivery girl Ramona captures Scott Pilgrim's heart, but he must vanquish all seven of her evil exes in martial arts battles to win her love."
s4440,Movie,Ne Zha,Yu Yang,"Lü Yanting, Joseph, Han Mo, Chen Hao, Lü Qi, Zhang Jiaming, Yang Wei",China,2020-05-25,2019,TV-14,110 min,"Action & Adventure, Comedies, International Movies","Bound by a divine mandate, rebellious outcast Ne Zha grapples with his formidable powers and a destiny that would imperil his loved ones."
s3180,Movie,Jimmy Neutron: Boy Genius,John A. Davis,"Debi Derryberry, Jeffrey Garcia, Rob Paulsen, Megan Cavanagh, Mark DeCarlo, Carolyn Lawrence, Andrea Martin, Candi Milo, Crystal Scales, Martin Short, Patrick Stewart, Jim Cummings",United States,2020-01-01,2001,G,83 min,"Children & Family Movies, Comedies, Sci-Fi & Fantasy","When gooey green aliens kidnap all the adults in Retroville, it's up to 11-year-old Jimmy Neutron to come up with a plan to rescue them."
s5163,TV Show,Reply 1994,Shin Won-ho,"Go Ara, Jung Woo, Sung Dong-il, Dohee, Son Ho-jun, Kim Sung-kyun, Cha Seon-wu, Yoo Yeon-seok, Lee Il-hwa",South Korea,2019-08-08,2014,TV-MA,1 Season,"International TV Shows, Korean TV Shows, Romantic TV Shows","All hailing from various parts of Korea, a group of college students go from being complete strangers to a big happy family at a Seoul boarding house."
s2889,Movie,I Am Bolt,"Benjamin Turner, Gabe Turner",Usain Bolt,United Kingdom,2017-10-01,2016,PG,107 min,"Documentaries, Sports Movies","Mixing archival footage with present-day interviews, Olympic champion and global icon Usain Bolt opens up about his athletic legacy."
s6634,Movie,The Magic School Bus Rides Again The Frizz Connection,Richard Weston,"Kate McKinnon, Roman Lutterotti, Mikaela Blake, Gabby Clarke, Leke Maceda-Rustecki, Matthew Mucci, Birva Pandya, Lynsey Pham, Kaden Stephen",Canada,2020-10-20,2020,TV-Y,46 min,Children & Family Movies,"Lightning splits the Magic School Bus into three pieces, scattering the class across the globe with different versions of Ms. Frizzle aboard each bus!"
s6552,Movie,The Last Bomb of the Second World War,Athiyan Athirai,"Dinesh, Anandhi, Munishkanth, Riythvika, John Vijay",India,2020-03-03,2019,TV-14,133 min,"Dramas, Independent Movies, International Movies",A piece of unexploded ordnance wreaks havoc on the lives of a scrapyard worker whose truck it falls into and an anti-war activist who's hunting for it.
s202,Movie,A Love Story,Maryo J. De los Reyes,"Maricel Soriano, Aga Muhlach, Angelica Panganiban, Dante Rivero, Chin Chin Gutierrez, Bobby Andrews, TJ Trinidad, Baron Geisler, John Arcilla, Gerald Madrid",Philippines,2019-03-14,2007,TV-14,117 min,"Dramas, International Movies, Romantic Movies","Self-made millionaire Ian thinks he's found happiness when he marries caring Joanna, but his love is put to the test when he meets stewardess Karyn."
s4366,Movie,My Way,Antongiulio Panizzi,"Silvio Berlusconi, Alan Friedman",Italy,2016-11-08,2016,TV-14,101 min,"Documentaries, International Movies","Former Italian prime minister Silvio Berlusconi opens up about his life, including his sex scandals, corruption trials, and friendship with Putin."
s3999,Movie,Maya Angelou: And Still I Rise,"Bob Hercules, Rita Coburn Whack","Maya Angelou, Cicely Tyson, Common, John Singleton, Alfre Woodard, Oprah Winfrey, Quincy Jones",United States,2017-05-01,2016,TV-PG,114 min,Documentaries,Poet and civil rights activist Maya Angelou is celebrated using her own words set over rare photographs and video illustrating her remarkable life.
s7087,Movie,Tik Tok,Li Jun,"Wallace Chung, Jung-jae Lee, Lang Yueting, Chae-yeong Lee",China,2017-07-01,2016,TV-14,108 min,"Dramas, International Movies, Thrillers",A police officer and a psychologist learn of a sinister threat at a highly anticipated soccer match and team up in hopes of preventing disaster.
s4045,Movie,Mere Pyare Prime Minister,Rakeysh Omprakash Mehra,"Anjali Patil, Om Kanojiya, Niteesh Wadhwa, Makrand Deshpande, Syna Anand, Prasad, Adarsh, Rasika Agashe",India,2019-05-31,2019,TV-MA,103 min,"Dramas, International Movies","When his mother suffers a traumatic incident, a boy from the Mumbai slums treks to Delhi to deliver his written plea for justice to the Prime Minister."
s3239,TV Show,Julie and the Phantoms,Kenny Ortega,"Madison Reyes, Charlie Gillespie, Owen Patrick Joyner, Jeremy Shada, Jadah Marie, Sacha Carlson, Savannah Lee May, Cheyenne Jackson, Carlos Ponce, Booboo Stewart, Sonny Bustamante",United States,2020-09-10,2020,TV-G,1 Season,"Kids' TV, TV Comedies","Julie lost her passion for music when she lost her mom. But when three ghostly guys appear and lift her spirits, they decide to start a band together!"
s3203,Movie,John Carter,Andrew Stanton,"Taylor Kitsch, Lynn Collins, Samantha Morton, Willem Dafoe, Thomas Haden Church, Mark Strong, Ciarán Hinds, Dominic West, James Purefoy, Bryan Cranston, Polly Walker, Daryl Sabara, Art Malik, Eileen Page, Amanda Clayton, Davood Ghadami, Daniel O'Meara, Jill Baker, Josh Daugherty, Oliver Boot, Philip Arditti, Arkie Reece, Joe Billingiere, Don Stark, Darwin Shaw, Figs Jackman, David Schwimmer, Emma Clifford, Christopher Goodman, Cate Fowler, Sean Carrigan, Dusty Sorg, Steven Cree, Phil Cheadle, Holly Weston, Nicholas Woodeson, Rupert Frazer, Edmund Kente",United States,2019-05-02,2012,PG-13,133 min,"Action & Adventure, Sci-Fi & Fantasy","One minute, Civil War veteran John Carter is evading Apaches; the next, he's waking up on Mars, a once-fruitful planet that's devolved into chaos."
s1664,Movie,Dear Ex,"Hsu Chih-yen, Mag Hsu","Roy Chiu, Hsieh Ying-xuan, Joseph Huang, Spark Chen",Taiwan,2019-02-01,2018,TV-MA,100 min,"Comedies, Dramas, International Movies","A teen navigates a bitter feud between his willful mom and a free-spirited man, who's the lover and insurance beneficiary of his recently deceased dad."
s7595,Movie,White Chamber,Paul Raschid,"Shauna MacDonald, Oded Fehr, Amrita Acharia, Sharon Maughan, Nicholas Farrell, Candis Nergaard, Marcus Griffiths, Adrianna Edwards, Sumit Chakravarti, Lisa Reynolds",United Kingdom,2019-08-01,2018,TV-MA,89 min,"Sci-Fi & Fantasy, Thrillers","When a civil war ravages the UK, a scientist awakens in a futuristic cell and is tortured by her captor for information she claims she doesn't possess."
s1863,Movie,Dream Big: Engineering Our World,Greg MacGillivray,Jeff Bridges,United States,2018-07-01,2017,TV-G,42 min,Documentaries,"Narrated by Jeff Bridges, this compelling documentary examines some incredible achievements of engineering from across the globe."
s7264,Movie,Tum Milo Toh Sahi,Kabir Sadanand,"Nana Patekar, Dimple Kapadia, Sunil Shetty, Vidya Malvade, Rehan Khan, Anjana Sukhani, Mohnish Bahl, Vrajesh Hirjee",India,2018-07-01,2010,TV-14,128 min,"Comedies, Dramas, International Movies",An astute but old-fashioned law clerk steps up to help the owner of a cafe in a legal battle that has both business and personal ramifications.
s6021,Movie,Temporada de Caza,Natalia Garagiola,"Germán Palacios, Lautaro Bettoni, Boy Olmi, Rita Pauls, Pilar Benitez Vibart, Diana Szeinblum","Argentina, France, United States, Germany, Qatar",2018-07-15,2017,TV-MA,108 min,"Dramas, International Movies",Animosity gives way to love and forgiveness when an angry teenager reunites with his estranged biological father in the wilds of Patagonia.
s4163,Movie,Mohamed Hussein,Muhammad Ali,"Mohamed Saad, Samir Sabri, Mai Selim, Dina Mohsen, Bayoumi Fouad, Mohammed Tharwat, Feryal Youssef, Nabil Issa, Ahmed Seyam, Hassan Abdulfattah, Hamdi Al Wazir, Mohamed Shahin",Egypt,2020-12-20,2019,TV-14,96 min,"Comedies, International Movies",A luxury hotel chauffeur's life is turned upside down when he unexpectedly becomes the focus of a renowned painter's final art project.
s1767,Movie,Dinner for Schmucks,Jay Roach,"Steve Carell, Paul Rudd, Zach Galifianakis, Jemaine Clement, Jeff Dunham, Bruce Greenwood, Ron Livingston, Chris O'Dowd, Lucy Punch, Stephanie Szostak, David Walliams, Larry Wilmore",United States,2020-01-01,2010,PG-13,115 min,Comedies,The host of a dinner party invites his friends to bring the saddest loser they can find. But the ultimate schmuck turns everyone else into the losers.
s2362,Movie,Garuda Di Dadaku,Ifa Isfansyah,"Emir Mahira, Maudy Koesnaedi, Ikranagara, Aldo Tansani, Marsha Aruan, Ari Sihasale",Indonesia,2018-10-09,2009,TV-PG,96 min,"Children & Family Movies, Dramas, Sports Movies","A determined boy will do anything to become a great soccer player, despite the wishes of his grandfather."
s157,Movie,A Chaster Marriage,Umut Kirca,"Emre Karayel, Ceren Moray, Begüm Kütük, Ececan Gümeci, Ümit Erdim, Cem Kiliç, Haldun Boysan, Ferdi Akarnur, Mine Teber, Güneş Hayat",Turkey,2020-10-02,2016,TV-14,94 min,"Comedies, International Movies, Romantic Movies","Forced to wed his childhood friend, a man obsessed with football attempts to get rid of his wife in order to keep the woman he truly loves."
s2368,Movie,Gemini,P.K. Baaburaaj,"Esther Anil, Sijoy Varghese, Renji Panicker, Thanusree Ghosh, Sasi Kalinga, Kishore Sathya, Sethu Lakshmi, Rosin Jolly",India,2018-07-01,2018,TV-PG,130 min,Dramas,"Despite growing up with traits that set her apart from her peers, a young adopted girl discovers her gift when she takes an interest in spelling bees."
s6881,Movie,The Smurfs,Raja Gosnell,"Hank Azaria, Neil Patrick Harris, Jayma Mays, Sofía Vergara, Tim Gunn, Jonathan Winters, Katy Perry, Alan Cumming, Fred Armisen, George Lopez, Anton Yelchin, Kenan Thompson, Jeff Foxworthy, John Oliver, Wolfgang Puck, B.J. Novak, Paul Reubens","United States, Belgium, Canada",2020-09-01,2011,PG,103 min,"Children & Family Movies, Comedies","When evil Gargamel tries to capture them, the Smurfs flee their woodland home, pass through a magic portal and find themselves stranded in New York."
s4441,Movie,Neal Brennan: 3 Mics,Neal Brennan,Neal Brennan,United States,2017-01-17,2017,TV-MA,66 min,Stand-Up Comedy,"Wicked one-liners and soul-baring confessions converge in this uniquely intimate stand-up special from ""Chappelle's Show"" co-creator Neal Brennan."
s2267,Movie,Freaks,"Adam B. Stein, Zach Lipovsky","Emile Hirsch, Bruce Dern, Lexy Kolker, Grace Park, Amanda Crew, Aleks Paunovic, Michelle Harrison","United States, Canada",2020-03-03,2018,R,105 min,"Independent Movies, Sci-Fi & Fantasy, Thrillers","Hidden away by her eccentric father, a mysterious young girl uncovers frightening truths when she starts to make contact with the outside world."
s1025,Movie,Boi,Jorge M. Fontana,"Bernat Quintana, Adrian Pang, Andrew Lua, Rachel Lascar, Fina Rius, Miranda Gas",Spain,2019-07-26,2018,TV-MA,111 min,"Dramas, Independent Movies, International Movies",A young chauffeur who's at a crossroads in his life escorts a pair of clients around Barcelona and becomes embroiled in their mysterious quest.
s2593,Movie,Handsome Devil,John Butler,"Fionn O'Shea, Nicholas Galitzine, Andrew Scott, Michael McElhatton, Moe Dunford, Ruairí O'Connor, Jay Duffy, Mark Lavery, Jamie Hallahan, Ardal O'Hanlon, Amy Huberman",Ireland,2017-08-01,2016,TV-MA,95 min,"Comedies, Dramas, International Movies","A self-described outsider is sent to a rugby-obsessed boarding school, where he forms an unexpected bond with the star player."
s5522,Movie,Sex and the City: The Movie,Michael Patrick King,"Sarah Jessica Parker, Kim Cattrall, Kristin Davis, Cynthia Nixon, Chris Noth, Candice Bergen, Jennifer Hudson, David Eigenberg, Evan Handler, Jason Lewis, Mario Cantone, Lynn Cohen",United States,2021-01-01,2008,R,145 min,"Comedies, Dramas, Romantic Movies","When Carrie's big step forward in her relationship goes awry, best friends Charlotte, Miranda and Samantha are there to help her pick up the pieces."
s5673,Movie,Small Crimes,Evan Katz,"Nikolaj Coster-Waldau, Gary Cole, Molly Parker, Macon Blair, Pat Healy, Jacki Weaver, Robert Forster","Canada, United States",2017-04-28,2017,TV-MA,95 min,"Dramas, Thrillers","After serving a six-year prison sentence, an ex-cop tries to rebuild his life in his hometown, but gets caught up in the fallout from his past."
s6171,Movie,The Brave,William Kaufman,"Armand Assante, Louis Mandylor, Yuriy Kutsenko, Ravshana Kurkova, Igor Jijikine, Ivan Makarevich, Bessart Kallaku, Ervin Bejleri",United States,2020-01-15,2019,TV-MA,103 min,"Action & Adventure, Independent Movies","With entry into the European Union at stake, Albania must rely on a mash-up of elite cops to take down a slippery drug lord dominating its economy."
s965,Movie,Black Snow,Martin Hodara,"Ricardo Darín, Leonardo Sbaraglia, Laia Costa, Federico Luppi, Dolores Fonzi, Andrés Herrera","Argentina, Spain",2017-07-01,2017,TV-MA,91 min,"Dramas, International Movies, Thrillers",An old tragedy and lingering animosity erupt when a man returns to Patagonia to convince his estranged brother to sell the family's isolated property.
s7167,Movie,Tracers,Daniel Benmayor,"Luciano Acuna Jr., Adam Rayner, Marie Avgeropoulos, Rafi Gavron, Taylor Lautner, Sam Medina, Amirah Vann, Johnny M. Wu, Josh Yadon, Christian Steel",United States,2019-10-22,2015,PG-13,94 min,Action & Adventure,"When a bike messenger falls into debt with organized criminals, a sexy woman draws him into her high-stakes world of parkour, teaching him new skills."
s4108,Movie,MindGamers,Andrew Goth,"Tom Payne, Melia Kreiling, Antonia Campbell-Hughes, Sam Neill, Turlough Convery, Oliver Stark, Dominique Tipper, Ryan Doyle, Simon Paisley-day, Pedja Bjelac",Austria,2020-01-15,2017,R,99 min,"International Movies, Sci-Fi & Fantasy, Thrillers","Brilliant young students discover a breakthrough that could change humankind, but soon find themselves the subjects of a much bigger experiment."
s883,Movie,Bhagam Bhag,Priyadarshan,"Akshay Kumar, Govinda, Lara Dutta, Paresh Rawal, Rajpal Yadav, Jackie Shroff, Arbaaz Khan, Tanushree Dutta, Asrani, Shakti Kapoor",India,2019-12-31,2006,TV-14,151 min,"Comedies, International Movies, Romantic Movies","A theater group lands in trouble when its new actress takes her own life, two of its members are framed for murder and no one is who they appear to be."
s4923,Movie,Pottersville,Seth Henrikson,"Michael Shannon, Judy Greer, Thomas Lennon, Ron Perlman, Christina Hendricks, Ian McShane",United States,2017-12-15,2017,PG-13,86 min,"Comedies, Independent Movies","A man's drunken romp in a gorilla suit gets him mistaken for Bigfoot, drawing media attention and tourist dollars to his struggling small town."
s7308,Movie,Ultras,Francesco Lettieri,"Aniello Arena, Antonia Truppo, Ciro Nacca, Simone Borelli, Daniele Vicorito, Salvatore Pelliccia",Italy,2020-03-20,2020,TV-MA,109 min,"Dramas, International Movies, Sports Movies",An aging soccer fanatic faces down the reality of his past while struggling to give himself and a young follower very different futures.
s1372,Movie,Christmas With A View,Justin G. Dyck,"Scott Cavalheiro, Kaitlyn Leeb, Vivica A. Fox, Patrick Duffy, Jess Walton, Mark Ghanimé",Canada,2018-11-01,2018,TV-PG,91 min,"International Movies, Romantic Movies","Still reeling from a business failure, the restaurant manager of a ski resort finds her world jolted by a new chef, who has his own hidden past."
s4841,Movie,Pettersson and Findus 2,Ali Samadi Ahadi,"Stefan Kurt, Marianne Sägebrecht, Max Herbrechter",Germany,2017-11-01,2016,TV-G,82 min,"Children & Family Movies, Comedies","Christmas is just around the corner, but Pettersson and Findus are worried the snowy weather (and lack of a tree) may keep them from celebrating."
s5794,Movie,StarBeam: Halloween Hero,Jon Izen,"Nahanni Mitchell, Dean Petriw, Terry Klassen, Sam Vincent, Rhona Rees, Laara Sadiq",Canada,2020-10-06,2020,TV-Y,33 min,Children & Family Movies,"Greedy Captain Fishbeard is stealing everybody's Halloween treats for himself, but StarBeam and Boost have some tricks up their sleeves to save the day!"
s4033,Movie,Men in Black II,Barry Sonnenfeld,"Tommy Lee Jones, Will Smith, Rip Torn, Lara Flynn Boyle, Johnny Knoxville, Rosario Dawson, Tony Shalhoub, Patrick Warburton, Jack Kehler, David Cross",United States,2019-10-01,2002,PG-13,88 min,"Action & Adventure, Comedies, Sci-Fi & Fantasy",Will Smith and Tommy Lee Jones reprise their roles as two highly secretive and unofficial government agents dealing with all things evil and alien.
s176,Movie,A Ghost Story,David Lowery,"Casey Affleck, Rooney Mara, Liz Franke, Rob Zabrecky, Will Oldham, Sonia Acevedo",United States,2020-01-07,2017,R,92 min,"Dramas, Independent Movies","Following a fatal car crash, a man's spirit remains stuck in the home he shared with his wife as doors into the past and future begin to open."
s166,Movie,A Clockwork Orange,Stanley Kubrick,"Malcolm McDowell, Patrick Magee, Michael Bates, Warren Clarke, Adrienne Corri, Paul Farrell, Miriam Karlin, James Marcus","United Kingdom, United States",2020-11-01,1971,R,137 min,"Classic Movies, Cult Movies, Dramas","In this dark satire from director Stanley Kubrick, a young, vicious sociopath in a dystopian England undergoes an experimental rehabilitation therapy."
s5383,Movie,Santa Girl,Blayne Weaver,"Barry Bostwick, Jennifer Stone, Devon Werkheiser, McKayla Witt, Joshua Cody, Hank Stone",United States,2019-11-01,2019,TV-PG,91 min,"Children & Family Movies, Comedies, Romantic Movies","Fleeing the family business and an arranged marriage, Santa’s daughter chooses a magical adventure of her own: College."
s7472,Movie,Wanda Sykes: Not Normal,Linda Mendoza,Wanda Sykes,United States,2019-05-21,2019,TV-MA,66 min,Stand-Up Comedy,"Wanda Sykes tackles politics, reality TV, racism and the secret she'd take to the grave in this rollicking, no-holds-barred stand-up special."
s4959,Movie,Pranaam,Sanjiv Jaiswal,"Rajeev Khandelwal, Samiksha Singh, S.M. Zaheer, Vikram Gokhale, Meenakshi Sethi, Atul Kulkarni, Abhimanyu Singh, Aniruddha Dave",India,2019-11-25,2019,TV-14,117 min,"Action & Adventure, Dramas, International Movies","Aspiring to fulfill his father’s dream and become a civil services officer, a young man loses his way upon becoming entangled with a criminal lynchpin."
s756,Movie,Barry,Vikram Gandhi,"Devon Terrell, Anya Taylor-Joy, Jason Mitchell, Ashley Judd, Jenna Elfman, Ellar Coltrane, Avi Nash, Linus Roache, John Benjamin Hickey",United States,2016-12-16,2016,TV-MA,105 min,Dramas,"A young Barack Obama forges his identity while dealing with race, divergent cultures and ordinary life as a New York City college student."
s5531,Movie,Shéhérazade,Jean-Bernard Marlin,"Dylan Robert, Kenza Fortas, Idir Azougli, Lisa Amedjout, Sofia Bent, Nabila Bounad, Kader Benchoudar, Nabila Ait Amer",France,2019-05-11,2019,TV-MA,111 min,"Dramas, Independent Movies, International Movies","Fresh out of juvenile detention in Marseille, 17-year-old Zach falls for a young prostitute and soon faces a dire dilemma while working as a pimp."
s6682,Movie,The Model,Mads Matthiesen,"Maria Palm, Ed Skrein, Yvonnick Muller, Charlotte Tomaszewska, Virgile Bramly, Marco Ilsø, Dominic Allburn",Denmark,2016-12-06,2016,TV-MA,104 min,"Dramas, Independent Movies, International Movies","Danish teen Emma moves to Paris hoping to become a top model, but her dreams soon unravel when her affair with photographer Shane turns obsessive."
s3204,Movie,John Day,Ahishor Solomon,"Naseeruddin Shah, Randeep Hooda, Shernaz Patel, Elena Kazan, Sharat Saxena, Vipin Sharma, Denzil Smith, Kenneth Desai, Sushil Pandey",India,2019-12-31,2013,TV-MA,125 min,"International Movies, Thrillers","A bank manager and his wife, still grieving over their daughter who died in a fire, become pawns in a bank heist with ties to corruption and fraud."
s7591,Movie,Whindersson Nunes: Adult,Diego Pignataro,Whindersson Nunes,Brazil,2019-08-15,2019,TV-MA,69 min,Stand-Up Comedy,Brazilian YouTube sensation Whindersson Nunes revisits his humble beginnings and much more in a series of playful stories and peculiar songs.
s3826,Movie,Lusers,Ticoy Rodriguez,"Carlos Alcántara, Pablo Granados, Felipe Izquierdo, Gaby Espino, Cristián de la Fuente, Marcela Guerty, Claudio Torres","Argentina, Chile, Peru",2016-07-15,2015,TV-MA,100 min,"Comedies, International Movies, Sports Movies",Three men from different nations must find their way out of the Amazon jungle – on foot – when they get lost on the way to Brazil's World Cup Final.
s3849,Movie,Madness in the Desert,Satyajit Bhatkal,"Aamir Khan, Ashutosh Gowariker",India,2021-01-10,2004,TV-14,141 min,"Documentaries, International Movies","The story of making ""Lagaan,"" one of the millennium's seminal Indian films, is told from the point of view of production team member Satyajit Bhatkal."
s43,Movie,Çok Filim Hareketler Bunlar,Ozan Açıktan,"Ayça Erturan, Aydan Taş, Ayşegül Akdemir, Burcu Gönder, Bülent Emrah Parlak, Büşra Pekin, Emre Canpolat, Ersin Korkut, Eser Yenenler, Gizem Tuğral, Gülhan Tekin, Gülsüm Alkan, Hamdi Kahraman, İbrahim Büyükak, Metin Keçeci",Turkey,2017-03-10,2010,TV-MA,99 min,"Comedies, International Movies","Vignettes of the summer holidays follow vacationers as they battle mosquitoes, suffer ruined plans and otherwise hit snags in their precious time off."
s7405,Movie,Verónica,"Carlos Algara, Alejandro Martinez-Beltran","Arcelia Ramírez, Olga Segura, Sofía Garza",Mexico,2017-10-01,2017,TV-MA,81 min,"Dramas, Independent Movies, International Movies","A reclusive psychologist agrees to treat a patient – whose therapist is missing – at her remote cabin, where the women test each other's boundaries."
s4225,Movie,Moor,Jami,"Hameed Sheikh, Samiya Mumtaz, Shaz Khan, Abdul Qadir, Shabbir Rana, Sultan Hussain, Ayaz Samoo, Nayyar Ejaz, Sonia Hussain","Pakistan, United States",2017-11-01,2015,TV-14,135 min,"Dramas, Independent Movies, International Movies","A railway stationmaster tries to cope with his wife's death, his estrangement from his son and the corrupt world in which he lives."
s3304,Movie,Kapoor & Sons,Shakun Batra,"Rishi Kapoor, Sidharth Malhotra, Fawad Khan, Alia Bhatt, Ratna Pathak Shah, Rajat Kapoor",India,2020-04-01,2016,TV-14,138 min,"Comedies, Dramas, International Movies","Returning home to visit their ill grandfather, two estranged brothers must confront their unresolved rivalry while their parents’ marriage frays."
s4065,Movie,MI-5,Bharat Nalluri,"Peter Firth, Kit Harington, Jennifer Ehle, Elyes Gabel, Eleanor Matsuura, Tim McInnerny, Lara Pulver, David Harewood, Tuppence Middleton",United Kingdom,2019-08-01,2015,R,105 min,"Action & Adventure, Dramas, International Movies","When a terrorist escapes custody, MI-5 director Harry Pearce becomes the scapegoat. But the wily veteran still has some spycraft tricks up his sleeve."
s6121,Movie,The Beast Stalker,Dante Lam,"Nicholas Tse, Nick Cheung, Zhang Jing-chu, Miao Pu, Liu Kai-chi, Philip Keung, Kwok Jing-hung, Sherman Chung, Zhang He, Wong Suet-yin, Wong Sum-yin",Hong Kong,2019-07-21,2008,TV-14,110 min,"Action & Adventure, International Movies","Feeling guilty after a high-speed chase leaves a girl dead, a determined sergeant pursues the crime boss who triggered the fatal car accident."
s1922,Movie,Edge of Fear,Bobby Roth,"Shen Lin, Robert Patrick, Zhu Zhu, Jodi Lyn O'Keefe, Robert Knepper, Amaury Nolasco, Rockmond Dunbar, Andy Mackenzie, Robert Crayton, John Edward Lee, Trent Brya",United States,2018-11-01,2018,TV-MA,92 min,"Independent Movies, Thrillers","During a wilderness getaway, a gang of sociopathic criminals kidnap a woman and assault her husband, who must summon all his strength to save her."
s654,Movie,B.A. Pass 2,Shadab Khan,"Kritika Sachdeva, Sasho, Sanghmitra Hitaishi, Indraneil Sengupta, Saurabh Dubey, Shubhangi Latkar, Sukhbir Kaur Lamba, Arav Chowdharry",India,2018-06-01,2017,TV-14,126 min,"Dramas, International Movies","A young woman eager to avoid an arranged marriage moves to Mumbai, where she learns hard truths about show business, life and love."
