show_id,type,title,director,cast,country,date_added,release_year,rating,duration,listed_in,description
s125,Movie,5Gang,Matei Dima,"Andrei Selaru, Dorian Popa, Julia Marcan, Ana Radu, Cosmin Nedelcu, Diana Condurache, Andrei Gavril, Luca Bogdan",Romania,2020-04-27,2019,TV-14,96 min,"Comedies, International Movies","To keep the band together, Selly tries to earn money by making an appearance at the birthday party of a mobster's daughter — until he gets kidnapped."
s7468,Movie,Walk with Me,"Marc Francis, Max Pugh","Benedict Cumberbatch, Thich Nhat Hanh",United Kingdom,2017-12-26,2017,TV-PG,94 min,Documentaries,A community of monks in France led by Zen Buddhist master Thich Nhat Hanh offers an intimate glimpse into mindfulness practice and the monastic life.
s1346,Movie,Chloe,Atom Egoyan,"Julianne Moore, Liam Neeson, Amanda Seyfried, Max Thieriot, R.H. Thomson, Nina Dobrev, Laura de Carteret, Mishu Vellani","United States, Canada, France",2020-01-01,2009,R,96 min,"Independent Movies, Thrillers","Suspecting her husband of infidelity, Catherine hires sexy Chloe to test his faithfulness. Soon, the relationships between all three intensify."
s5595,Movie,Si Doel the Movie 3,Rano Karno,"Rano Karno, Cornelia Agatha, Maudy Koesnaedi, Suty Karno, Mandra Naih, Aminah Tjendrakasih, Rey Bong, Akhmad Zulhoir Mardia",Indonesia,2020-05-23,2020,TV-G,93 min,"Dramas, International Movies, Music & Musicals","Torn between reuniting with one family and leaving another behind, Doel must choose between the two women he loves."
s2753,Movie,History of Joy,Vishnu Govindhan,"Vishnu Vinay, Vinay Forrt, Saikumar, Joju George, Nobi, Sreekumar, Nandu, Sunil Sukhada",India,2018-08-01,2017,TV-14,118 min,"Dramas, International Movies",The life of a high-flying law student takes a drastic turn when a bout of misfortune changes his status in society for good.
s5231,Movie,Road to Sangam,Amit Rai,"Paresh Rawal, Om Puri, Pavan Malhotra, Javed Sheikh, Swati Chitnis, Masood Akhtar, Sudhir Nema, Rakesh Srivastava",India,2019-12-31,2010,TV-14,136 min,"Dramas, Independent Movies, International Movies","As communal violence erupts in his neighborhood, a Muslim mechanic presses forward to repair a historic truck that will transport Gandhi’s last remains."
s1483,Movie,Conjuring Spirit,Van M. Pham,"Phuong Mai, Quang Su, Hoang Phuc Nguyen, Chi Pu, Tien Pham, Hoai An",Vietnam,2018-08-28,2014,TV-MA,112 min,"Horror Movies, International Movies, Thrillers","In the wake of her husband's betrayal, a novelist and mother moves to an old building, where she receives a music box and encounters a strange spirit."
s3395,Movie,Kilo Two Bravo,Paul Katis,"David Elliot, Mark Stanley, Scott Kyle, Benjamin O'Mahony, Bryan Parry, Liam Ainsworth, Andy Gibbins, John Doughty, Paul Luebke, Thomas Davison, Grant Kilburn, Robert Mitchell, Jon-Paul Bell, Malachi Kirby, Ali Cook",United Kingdom,2019-03-01,2014,R,109 min,"Dramas, Independent Movies, Thrillers","On patrol in Afghanistan, a British paratrooper unit unwittingly ventures into a dry riverbed that turns out to be littered with land mines."
s110,Movie,40 Sticks,Victor Gatonye,"Robert Agengo, Mwaura Bilal, Andreo Kamau, Cajetan Boy, Arabron Nyyeneque, Shiviske Shivisi, Xavier Ywaya",Kenya,2020-11-20,2019,TV-14,93 min,"International Movies, Thrillers","When their prison bus crashes in a forest on a rainy night, a group of criminals finds themselves battling wild animals and a mysterious killer."
s1157,Movie,Bye Bye London,Almunsif Alsuwaisi,"Abdulhussain Abdulredah, Ghanem Al-Saleh, Mariam Al-Ghadban, Dawood Hussain, Entesar Alsharah, Mohamed Gaber",Kuwait,2020-05-21,1981,TV-14,177 min,"Comedies, Dramas, International Movies","In this satirical play, a wealthy Kuwaiti businessman travels to London for pleasure and encounters a host of eccentric characters."
s7141,Movie,Tom Segura: Mostly Stories,Jay Karas,Tom Segura,United States,2016-01-08,2016,TV-MA,74 min,Stand-Up Comedy,"The bearded, bawdy and comically bitter Tom Segura gets real about body piercings, the ""Area 51"" of men's bodies, and the lie he told Mike Tyson."
s2871,Movie,Hunter's Prayer,Jonathan Mostow,"Sam Worthington, Odeya Rush, Amy Landecker, Allen Leech, Verónica Echegui","United States, Spain, Germany",2019-10-22,2015,R,91 min,"Action & Adventure, Independent Movies",A hired gun has second thoughts when he's contracted to kill a teenage girl whose father's shady business dealings put her life in danger.
s3400,Movie,King's Ransom,Jeffrey W. Byrd,"Anthony Anderson, Jay Mohr, Kellita Smith, Nicole Ari Parker, Regina Hall, Loretta Devine, Donald Faison, Leila Arcieri, Charlie Murphy, Brooke D'Orsay","United States, Canada",2019-11-01,2005,PG-13,98 min,"Action & Adventure, Comedies","A wealthy, despicable businessman comes to the realization that he may lose half his fortune to the obnoxious wife he's trying to divorce. So, he decides to arrange his own kidnapping in order to wipe himself out and claim poverty."
s924,Movie,Bill Hicks: Sane Man,"Kevin Booth, David Johndrow",Bill Hicks,United States,2018-12-31,1989,TV-MA,81 min,Stand-Up Comedy,"Filmed in 1989 at a turning point in comedian Bill Hicks's career, this rare onstage performance captures him spouting off on a variety of topics."
s3642,Movie,Lila & Eve,Charles Stone III,"Viola Davis, Jennifer Lopez, Andre Royo, Shea Whigham, Aml Ameen, Chris Chalk, Will Brittain, Michole Briana White, Julius Tennon, Gino Vento, Yolonda Ross",United States,2016-02-06,2015,R,94 min,"Dramas, Thrillers","After each of them loses a child to murder, two women who meet in a support group initiate their own investigation when the police are no help."
s5066,Movie,Ragini MMS 2,Bhushan Patel,"Sunny Leone, Saahil Prem, Parvin Dabas, Sandhya Mridul, Divya Dutta, Soniya Mehra, Kainaz Motivala, Karan Mehra",India,2019-05-31,2014,TV-MA,113 min,"Horror Movies, International Movies",The horror continues when Ragini's video goes viral and a sleazy director decides to make a movie about the incident in the original house.
s7549,Movie,What Did I Mess,Shady Hanna,"Rola Beksmati, Junaid Zeineldine, Abboudy Mallah, Tanya Nasr, Matteo El Khodr, Rita El Khoury, Tony Benn",Lebanon,2020-10-19,2018,TV-14,98 min,"Comedies, International Movies, Romantic Movies","In an attempt to get her ex to propose, Nayla hosts a gathering to introduce him to her new suitor — only for the party to turn into a hellish occasion."
s6955,Movie,The Twins Effect II,"Corey Yuen, Patrick Leung","Donnie Yen, Jaycee Chan, Charlene Choi, Gillian Chung, Wilson Chen Bo-Lin, Tony Leung Ka Fai, Qu Ying, Fan Bingbing, Xie Jing-jing, Daniel Wu, Edison Chen, Jackie Chan","Hong Kong, China",2019-07-21,2004,TV-14,106 min,"Action & Adventure, Comedies, International Movies",An empress rules over a land where men are subservient to women. But a prophecy reveals that a boy will become king and restore the male regime.
s7067,Movie,Three Words to Forever,Cathy Garcia-Molina,"Sharon Cuneta, Richard Gomez, Kathryn Bernardo, Liza Lorena, Freddie Webb, Tommy Esguerra, Joross Gamboa, Tobie Dela Cruz",Philippines,2020-11-19,2018,TV-G,107 min,"Comedies, Dramas, International Movies","As they near their 25th wedding anniversary, Rick and Cristy try to conceal their crumbling marriage while their family prepares for a big celebration."
s3616,Movie,Lez Bomb,Jenna Laurenzo,"Jenna Laurenzo, Deirdre O'Connell, Brandon Michael Hall, Kevin Pollak, Elaine Hendrix, Steve Guttenberg, Cloris Leachman, Bruce Dern",United States,2019-02-07,2018,TV-14,90 min,"Comedies, LGBTQ Movies",A young woman's attempt to come out of the closet on Thanksgiving gets complicated when her male roommate shows up to her parents' home unannounced.
s2788,Movie,Home Is Where the Killer Is,Kaila York,"Stacy Haiduk, Kelly Kruger, Christopher Sean, Anne Leighton, Beth Littleford, John-Paul Lavoisier, Kristoff St. John, Pallavi Sastry",United States,2019-10-09,2019,TV-14,87 min,"Dramas, Thrillers","Recovering from cancer, a young woman thinks she’s found a friend when she rents a room from a caring ex-doctor. But empathy soon becomes obsession."
s3352,Movie,Kevyn Aucoin: Beauty & the Beast in Me,Lori Kaye,"Kevyn Aucoin, Cindy Crawford, Naomi Campbell, Gwyneth Paltrow, Andie MacDowell, Paulina Porizkova, Amber Valletta",United States,2019-01-01,2017,TV-MA,90 min,"Documentaries, LGBTQ Movies",Makeup artist Kevyn Aucoin worked with top supermodels in the 1980s and 1990s. Personal videos merged with interviews provide a peek into his life.
s6405,Movie,The Good Neighbor,Kasra Farahani,"James Caan, Logan Miller, Keir Gilchrist, Laura Innes, Edwin Hodge, Anne Dudek, Bailey Noble, Lili Reinhart, Mindy Sterling",United States,2016-12-05,2016,TV-MA,97 min,"Dramas, Independent Movies, Thrillers","Two tech-savvy teens plot to fool a cranky old neighbor into believing his house is haunted, but their cruel prank soon takes some unexpected turns."
s5242,Movie,Rock My Heart,Hanno Olderdissen,"Lena Klenke, Dieter Hallervorden, Emilio Sakraya, Annette Frier, Milan Peschel, Vedat Erincin, Johann von Bülow, Michael Lott, Hans Martin Stier, Anneke Kim Sarnau",Germany,2019-06-07,2019,TV-PG,110 min,"Children & Family Movies, Dramas, International Movies","After an adventurous teen with a heart defect bonds with an unruly stallion, she trains to compete as an amateur jockey in a life-threatening race."
s232,Movie,A Sort of Homecoming,Maria Burton,"Laura Marano, Parker Mack, Katherine McNamara, Marcus Lyle Brown, Shayne Topp, Michelle Clunie, Kathleen Wilhoite",United States,2017-08-01,2015,TV-PG,89 min,"Dramas, Independent Movies",Ace news producer Amy is called back to her Louisiana hometown where memories of what used to be – and what might have been – come flooding back.
s5392,Movie,Sarajevo,Andreas Prochaska,"Florian Teichtmeister, Heino Ferch, Melika Foroutan, Juergen Maurer, Edin Hasanovic, Eugen Knecht, Mateusz Dopieralski, Dominik Warta, Simon Hatzl, Erwin Steinhauer, Friedrich von Thun, Juraj Kukura","Austria, Czech Republic",2017-01-15,2014,TV-PG,98 min,"Dramas, International Movies","Tasked with unraveling the assassination of Archduke Franz Ferdinand, an honorable magistrate finds himself targeted by the shadowy perpetrators."
s1928,Movie,Ee Nagaraniki Emaindi,Tharun Bhascker,"Vishwaksen Naidu, Sushanth Reddy, Abhinav Gomatam, Venkatesh Kakumanu, Anisha Ambrose, Simran Choudhary",India,2019-09-06,2018,TV-14,133 min,"Comedies, International Movies","In Goa and in desperate need of cash, four childhood friends get another shot at making their long-abandoned dreams of becoming filmmakers come true."
s964,Movie,Black Snake Moan,Craig Brewer,"Samuel L. Jackson, Christina Ricci, Justin Timberlake, S. Epatha Merkerson, John Cothran, David Banner, Michael Raymond-James, Adriane Lenox, Kim Richards, Neimus K. Williams",United States,2019-11-20,2007,R,116 min,"Dramas, Independent Movies","Lazarus finds Rae beaten and near death, and acts as a father figure to help redeem her. But before saving anyone, Lazarus must face his own demons."
s4276,Movie,Mukhsin,Yasmin Ahmad,"Mohd Syafie Naswip, Sharifah Aryana, Sharifah Aleya, Adibah Noor, Irwan Iskandar, Sallehuddin Abu Bakar",Malaysia,2020-12-18,2006,TV-PG,98 min,"Children & Family Movies, Comedies, Dramas","When young Mukhsin arrives in a new town, 10-year-old tomboy Orked adopts him as her new best friend, and the two develop a touching friendship that begins to spill over into the inklings of first love."
s5687,Movie,Socha Na Tha,Imtiaz Ali,"Abhay Deol, Ayesha Takia, Apoorva Jha, Ayesha Jhulka, Rati Agnihotri, Sandhya Mridul, Suresh Oberoi, Manish Chaudhary",India,2018-07-01,2005,TV-14,137 min,"Comedies, International Movies, Romantic Movies","An arranged marriage becomes a friendship for Viren and Aditi, who aren't in love – until they begin having unexpected feelings for each other."
s7749,Movie,الف مبروك,Ahmed Nader Galal,"Ahmed Helmy, Laila Ezz El Arab, Mahmoud El Fishawy, Mohamed Farraag, Sarrah Abdelrahman, Rahma Hassan, Amir Salah, Hany El Sabagh",Egypt,2020-04-25,2009,TV-14,115 min,"Comedies, Dramas, International Movies","On his wedding day, an arrogant, greedy accountant experiences a series of calamities that keep replaying as he lives the same day over and over again."
s1401,Movie,City of God,"Fernando Meirelles, Katia Lund","Alexandre Rodrigues, Leandro Firmino, Phellipe Haagensen, Douglas Silva, Jonathan Haagensen, Matheus Nachtergaele, Seu Jorge, Jefechander Suplino, Alice Braga","Brazil, France, Germany",2020-01-01,2002,R,130 min,"Dramas, Independent Movies, International Movies","Growing up in a Rio de Janeiro slum, Rocket is able to avoid being drawn into a life of drugs and crime by having a passion for photography."
s5440,Movie,Scorpion King 5: Book of Souls,Don Michael Paul,"Zach McGowan, Pearl Thusi, Nathan Jones, Peter Mensah, Katy Louise Saunders, Mayling Ng, Howard Charles, Inge Beckmann",United States,2018-10-23,2018,PG-13,102 min,"Action & Adventure, Sci-Fi & Fantasy",The Scorpion King joins forces with a Nubian princess in an all-or-nothing fight to stop a warlord from claiming the souls of the vanquished.
s7598,Movie,White Girl,Elizabeth Wood,"Morgan Saylor, Brian 'Sene' Marc, Justin Bartha, Chris Noth, Adrian Martinez, India Menuez, Anthony Ramos, Ralph Rodriguez, Annabelle Dexter-Jones",United States,2016-12-02,2016,TV-MA,90 min,"Dramas, Independent Movies","A college girl romping through New York City in search of cocaine and other highs finds something real to grasp, only to see it potentially slip away."
s1832,Movie,Dostana,Tarun Mansukhani,"Abhishek Bachchan, John Abraham, Priyanka Chopra, Bobby Deol, Kiron Kher, Sushmita Mukherjee, Shrey Bawa, Boman Irani","India, United States",2020-04-01,2008,TV-14,142 min,"Comedies, Dramas, International Movies","To win over a landlady who only accepts women as tenants, two men pose as a couple – but the jig may be up when they both fall for their flatmate."
s3840,Movie,Mad Money,"Callie Khouri, Jesse V. Johnson","Diane Keaton, Queen Latifah, Katie Holmes, Ted Danson, Roger Cross, Adam Rothenberg, Stephen Root, Christopher McDonald, Meagen Fay, J.C. MacKenzie, Finesse Mitchell, Eric Keenleyside",United States,2019-11-01,2008,PG-13,99 min,Comedies,A woman joins the janitorial staff of the Federal Reserve Bank and conspires with two co-workers to pilfer old money that's scheduled to be destroyed.
s2975,Movie,In the Shadow of the Moon,Jim Mickle,"Boyd Holbrook, Michael C. Hall, Cleopatra Coleman, Bokeem Woodbine, Rudi Dharmalingam, Rachel Keller","United States, Canada",2019-09-27,2019,TV-MA,116 min,"Dramas, Sci-Fi & Fantasy, Thrillers",A Philadelphia detective slowly unravels as he nurses a lifelong obsession with an enigmatic female serial killer whose crimes defy explanation.
s6160,Movie,The Boss Baby: Get That Baby!,"Dan Forgione, Pete Jacobs, Matt Whitlock","JP Karliak, Pierce Gagnon, Alex Cazares, Kevin Michael Richardson, Flula Borg, Rhys Darby, Wendie Malick, Jake Green",United States,2020-09-01,2020,TV-Y7,115 min,"Children & Family Movies, Comedies",Think you've got what it takes to be the boss? This interactive special puts your skills to the test and matches you up with one of 16 jobs at Baby Corp.
s1067,Movie,Boy and the World,Alê Abreu,"Vinícius Garcia, Felipe Zilse, Alê Abreu, Lu Horta, Marco Aurélio Campos, Cassius Romero, Alfredo Rollo",Brazil,2017-10-01,2013,PG,80 min,Children & Family Movies,"Young Cuca leaves his idyllic village on a grand adventure to find his father, who has traveled to the city seeking work."
s6786,Movie,The Prom,Ryan Murphy,"Meryl Streep, James Corden, Nicole Kidman, Kerry Washington, Andrew Rannells, Keegan-Michael Key, Jo Ellen Pellman, Ariana DeBose, Mary Kay Place, Kevin Chamberlin, Tracey Ullman, Logan Riley, Sofia Deler, Nico Greetham, Nathaniel J. Potvin",United States,2020-12-11,2020,PG-13,132 min,"Comedies, LGBTQ Movies, Music & Musicals",A group of down-on-their-luck Broadway stars shake up a small Indiana town as they rally behind a teen who just wants to attend prom with her girlfriend.
s4048,TV Show,Merlin,James Hawes,"Colin Morgan, Bradley James, Katie McGrath, Angel Coulby, Richard Wilson, Anthony Head, John Hurt, Nathaniel Parker",United Kingdom,2016-12-15,2012,TV-PG,5 Seasons,"British TV Shows, International TV Shows, TV Action & Adventure","This family-oriented retelling of the King Arthur legend finds Merlin arriving in Camelot, where he hones his magic skills with the help of his uncle."
s4,Movie,9,Shane Acker,"Elijah Wood, John C. Reilly, Jennifer Connelly, Christopher Plummer, Crispin Glover, Martin Landau, Fred Tatasciore, Alan Oppenheimer, Tom Kane",United States,2017-11-16,2009,PG-13,80 min,"Action & Adventure, Independent Movies, Sci-Fi & Fantasy","In a postapocalyptic world, rag-doll robots hide in fear from dangerous machines out to exterminate them, until a brave newcomer joins the group."
s1557,Movie,Curtiz,Tamas Yvan Topolanszky,"Ferenc Lengyel, Evelin Dobos, Declan Hannigan, Scott Alexander Young, József Gyabronka, Nikolett Barabas, Yan Feldman, Rafael Feldman, Christopher Krieg, Andrew Hefler, Lili Bordán",Hungary,2020-03-25,2018,TV-MA,99 min,"Dramas, International Movies","Driven and arrogant, film director Michael Curtiz deals with studio politics and family drama during the troubled production of ""Casablanca"" in 1942."
s6219,Movie,The Christmas Chronicles,Clay Kaytis,"Kurt Russell, Darby Camp, Judah Lewis, Kimberly Williams-Paisley, Oliver Hudson, Lamorne Morris, Martin Roach",United States,2018-11-22,2018,TV-PG,104 min,"Children & Family Movies, Comedies","After accidentally crashing Santa's sleigh, a brother and sister pull an all-nighter to save Christmas with a savvy, straight-talking St. Nick."
s3166,Movie,"Jim & Andy: The Great Beyond - Featuring a Very Special, Contractually Obligated Mention of Tony Clifton",Chris Smith,Jim Carrey,"Canada, United States",2017-11-17,2017,TV-MA,94 min,Documentaries,"Through the lens of his stunningly immersive performance as Andy Kaufman, Jim Carrey ponders the meaning of life, reality, identity and career."
s6663,Movie,The Meyerowitz Stories (New and Selected),Noah Baumbach,"Adam Sandler, Ben Stiller, Dustin Hoffman, Elizabeth Marvel, Grace Van Patten, Emma Thompson, Candice Bergen, Rebecca Miller, Danny Flaherty, Sakina Jaffrey, Adam David Thompson",United States,2017-10-13,2017,TV-MA,113 min,"Comedies, Dramas, Independent Movies",Grudges and rivalries abound as three adult siblings converge in New York to contend with their prickly artist father – and his fading legacy.
s4277,Movie,Mumbai Cha Raja,Manjeet Singh,"Rahul Bairagi, Arbaaz Khan, Tejas Parvatkar, Dhanshree Jain, Salman Khan, Aftab Khan",India,2016-11-15,2012,TV-MA,77 min,"Dramas, Independent Movies, International Movies","This coming-of-age tale follows Rahul, a young boy growing up in a Mumbai slum whose alcoholic father abuses him and his mother."
s5551,Movie,Shawn Mendes: Live in Concert,Paul Dugdale,Shawn Mendes,"United Kingdom, United States",2020-11-25,2020,TV-PG,87 min,Music & Musicals,"In his hometown of Toronto, Shawn Mendes pours his heart out on stage with a live performance in a stadium packed with adoring fans."
s4633,Movie,Once Upon a Time in London,Simon Rumley,"Leo Gregory, Terry Stone, Doug Allen, Andy Beckwith, Kate Braithwaite, Holly Earl, Joe Egan, Nadia Forde",United Kingdom,2020-04-15,2019,TV-MA,111 min,"Dramas, International Movies","Organized crime came to London in the 1930s, ushering in three decades ruled by two legendary gangsters whose legacy outlived their reign."
s920,Movie,Bill Hicks: One Night Stand,John Fortenberry,Bill Hicks,United Kingdom,2018-12-31,1991,TV-MA,28 min,Stand-Up Comedy,"Bill Hicks remembers a wild night in 1989 and offers his views on puffing cigarettes, smoking weed, drinking, sex, commercials and music."
s3310,Movie,Karthik Calling Karthik,Vijay Lalwani,"Farhan Akhtar, Deepika Padukone, Ram Kapoor, Vivan Bhatena, Vipin Sharma, Yatin Karyekar, Shefali Shah",India,2019-12-15,2010,TV-14,135 min,"Dramas, International Movies, Thrillers","Unlucky in love and bullied at work, an office drone is resigned to his dead-end life until it’s transformed by mysterious calls from … himself."
s1734,Movie,Dhan Dhana Dhan Goal,Vivek Agnihotri,"John Abraham, Bipasha Basu, Arshad Warsi, Shernaz Patel, Boman Irani, Dibyendu Bhattacharya, Gilbert Montoya, Dalip Tahil, Rajendranath Zutshi","United Kingdom, India",2018-11-01,2007,TV-14,157 min,"Dramas, Music & Musicals, Sports Movies","In a last-ditch effort, the jaded coach of the Southall United Football Club assembles a ragtag team and helps lead the team to a comeback season."
s3430,Movie,Kocan Kadar Konus,Kıvanç Baruönü,"Ezgi Mola, Murat Yıldırım, Gülenay Kalkan, Ebru Cündübeyoğlu, Eda Ece, Begüm Öner, Gül Arıcı, Muhammet Uzuner",Turkey,2017-03-10,2015,TV-14,104 min,"Comedies, International Movies, Romantic Movies",A 30-year-old who's never taken the traditional path to love is tutored by her friends and family before reconnecting with her high school crush.
s2315,Movie,Fun Mom Dinner,Alethea Jones,"Katie Aselton, Toni Collette, Bridget Everett, Molly Shannon, Adam Scott, Rob Huebel, Adam Levine, Paul Rust",United States,2017-12-31,2017,R,82 min,"Comedies, International Movies","Four preschool moms with little in common need a night out to take a break from their kids. But one thing leads to another, and things get rowdy."
s51,Movie,"10,000 B.C.",Roland Emmerich,"Steven Strait, Camilla Belle, Cliff Curtis, Joel Virgel, Affif Ben Badra, Mo Zinal, Nathanael Baring, Mona Hammond, Omar Sharif","United States, South Africa",2019-06-01,2008,PG-13,109 min,Action & Adventure,Fierce mammoth hunter D'Leh sets out on an impossible journey to rescue the woman he loves from a vicious warlord and save the people of his village.
s1146,Movie,Burning,Lee Chang-dong,"Yoo Ah-in, Steven Yeun, Jun Jong-seo, Kim Soo-kyung, Moon Sung-keun, ChoI Seung-ho","South Korea, Japan",2019-04-29,2018,TV-MA,148 min,"Dramas, Independent Movies, International Movies",An aspiring writer goes to the airport to pick up a high school friend returning from a trip to Africa but is disheartened to see her with another man.
s5071,Movie,Rain Man,Barry Levinson,"Dustin Hoffman, Tom Cruise, Valeria Golino, Gerald R. Molen, Jack Murdock, Michael D. Roberts, Ralph Seymour, Lucinda Jenney, Bonnie Hunt",United States,2019-07-01,1988,R,134 min,"Classic Movies, Dramas","A fast-talking yuppie is forced to slow down when he meets the brother he never knew he had, an unusually gifted autistic savant named Raymond."
s999,Movie,Blue Jay,Alex Lehmann,"Sarah Paulson, Mark Duplass, Clu Gulager",United States,2016-12-06,2016,TV-MA,81 min,"Dramas, Independent Movies, Romantic Movies","Two former high school sweethearts unexpectedly reunite in their old hometown, where they rediscover their magical bond and face a shared regret."
s3374,Movie,Kids on the Block,Tugçe Soysop,"Selim Bayraktar, Berat Efe Parlar, Esat Polat Güler, Eda Döğer, Dora Dalgıç, Taha Sönmezisik, Zeynep Ilgin Çelik, Arda Taşarcan, Alperen Efe Esmer, İlknur Külahlıoglu, İkra Külahlıoğlu",Turkey,2019-10-04,2019,TV-PG,102 min,"Children & Family Movies, Comedies","When their fun in the park is threatened by a neighborhood nagger, a group of friends declares war to play freely on their turf."
s802,Movie,Becoming Jane,Julian Jarrold,"Anne Hathaway, James McAvoy, Julie Walters, James Cromwell, Maggie Smith, Laurence Fox, Ian Richardson","United Kingdom, Ireland",2019-01-12,2007,PG-13,121 min,"Dramas, Romantic Movies",A passionate romance with roguish barrister Tom Lefroy serves as the inspiration for the works of budding novelist Jane Austen.
s790,Movie,Beats,Chris Robinson,"Khalil Everage, Anthony Anderson, Uzo Aduba, Emayatzy Corinealdi, Paul Walter Hauser, Dave East, Seandrea Sledge, Ashley Jackson, Megan Sousa",United States,2019-06-19,2019,TV-MA,110 min,"Dramas, Independent Movies, Music & Musicals","On Chicago's South Side, hip-hop prodigy August Monroe navigates crippling anxiety and new creative frontiers with the help of an unlikely mentor."
s5903,Movie,Super Monsters: The New Class,Steve Ball,"Elyse Maloway, Vincent Tong, Erin Mathews, Andrea Libman, Alessandro Juliani, Nicole Anthony, Diana Kaarina, Gigi Saul Guerrero, Asia Mattu, Rukiya Bernard, Elicia MacKenzie, Ian James Corlett, Britt McKillip",Canada,2020-08-01,2020,TV-Y,25 min,Children & Family Movies,"A new class of pint-sized preschoolers arrives at Pitchfork Pines, and the Super Monsters take their superpowers to the next level — the Purple Room!"
s4500,Movie,Nobody Knows I'm Here,Gaspar Antillo,"Jorge García, Millaray Lobos, Luis Gnecco, Alejandro Goic, Gastón Pauls, Eduardo Paxeco",Chile,2020-06-24,2020,TV-MA,92 min,"Dramas, Independent Movies, International Movies","A former child singer, traumatized by his experiences, becomes a recluse, nurturing his hurt until a woman comes into his life and really hears him."
s4360,Movie,My Stupid Boss 2,Upi Avianto,"Reza Rahadian, Bunga Citra Lestari, Chew Kin Wah, Atikah Suhaime, Iedil Putra, Iskandar Zulkarnain, Alex Abbad, Melissa Karim",Indonesia,2020-04-23,2019,TV-14,95 min,"Comedies, International Movies","Having driven away many of his employees, Bossman and three of his long-suffering workers try to find cheap labor in Vietnam but find trouble instead."
s5910,Movie,Superlopez,Javier Ruiz Caldera,"Dani Rovira, Alexandra Jiménez, Julián López, Maribel Verdú, Pedro Casablanc, Gracia Olayo, Ferran Rañé, Gonzalo de Castro, Mireia Portas",Spain,2019-03-24,2018,TV-MA,108 min,"Action & Adventure, Comedies, International Movies","In this adaptation of the comic strip, Juan López must balance an office job with heroic feats to save the love of his life and native planet Chitón."
