show_id,type,title,director,cast,country,date_added,release_year,rating,duration,listed_in,description
s4543,Movie,Now and Then,Lesli Linka Glatter,"Christina Ricci, Rosie O'Donnell, Thora Birch, Melanie Griffith, Gaby Hoffmann, Demi Moore, Ashleigh Aston Moore, Rita Wilson, Janeane Garofalo, Hank Azaria, Bonnie Hunt, Cloris Leachman",United States,2019-08-02,1995,PG-13,102 min,Dramas,"Waxing nostalgic about the bittersweet passage from childhood to puberty, four childhood girlfriends recall the magical summer of 1970."
s1398,Movie,Citation,Kunle Afolayan,"Temi Otedola, Jimmy Jean-Louis, Joke Silva, Gabriel Afolayan, Adjetey Anang, Ini Edo, Sadiq Daba, Wole Olowomojuore, Yomi Fash-Lanso, Bukunmi Oluwashina, Bienvenu Neba, Ray Reboul, Ibukun Awosika, Seun Kuti",Nigeria,2020-11-06,2020,TV-MA,151 min,"Dramas, International Movies",A bright student in Nigeria takes on the academic establishment when she reports a popular professor who tried to rape her. Based on real events.
s331,Movie,Aftermath,Elliott Lester,"Arnold Schwarzenegger, Scoot McNairy, Maggie Grace, Judah Nelson, Glenn Morshower, Hannah Ware, Mo McRae, Martin Donovan, Larry Sullivan, Mariana Klaveno, Kevin Zegers, Lewis Pullman","United Kingdom, United States",2020-03-15,2017,R,94 min,Dramas,"After an air traffic controller's mistake results in a tragic accident, a man who lost his wife and daughter seeks answers from the man responsible."
s216,Movie,A Perfect Man,Kees Van Oostrum,"Liev Schreiber, Jeanne Tripplehorn, Joelle Carter, Louise Fletcher, Katie Carr, Renée Soutendijk, Huub Stapel, Michael Pas",United States,2019-06-06,2013,R,94 min,"Dramas, Independent Movies, Romantic Movies","Nina thinks her husband, James, is cheating on her, and she sets out to prove it by calling him and pretending to be another woman."
s7682,Movie,Wyatt Earp,Lawrence Kasdan,"Kevin Costner, Dennis Quaid, Gene Hackman, David Andrews, Linden Ashby, Jeff Fahey, Joanna Going, Mark Harmon, Michael Madsen, Catherine O'Hara, Bill Pullman, Isabella Rossellini, Tom Sizemore",United States,2020-01-01,1994,PG-13,191 min,Action & Adventure,"Legendary lawman Wyatt Earp is continually at odds with a gang of renegade cowboys, culminating in a fiery showdown with the outlaws at the OK Corral."
s258,Movie,A Yellow Bird,K. Rajagopal,"Sivakumar Palakrishnan, Huang Lu, Seema Biswas, Udaya Soundari, Nithiyia Rao, Indra Chandran","Singapore, France",2017-05-01,2016,TV-MA,111 min,"Dramas, Independent Movies, International Movies","In Singapore, a homeless ex-convict hoping to reunite with his family forms a bond with a Chinese sex worker while serving as her bodyguard."
s3909,Movie,Maniyarayile Ashokan,Shamzu Zayba,"Jacob Gregory, S.V. Krishna Shankar, Shine Tom Chacko, Vijayaraghavan, Sri Lakshmi, Anupama Parameswaran, Dulquer Salmaan, Nazriya Fahad",India,2020-08-31,2020,TV-14,110 min,"Comedies, International Movies, Romantic Movies","When his unlucky horoscope doesn’t bode well for his future wife, an earnest bachelor goes to surprising lengths to get the family he’s always wanted."
s7152,Movie,Tootsies & The Fake,Kittiphak Thonguam,"Araya A. Hargate, Paopetch Charoensook, Thongkanthom Thongchai, Ratthanant Janyajirawong, Pattarasaya Kreuasuwansri, Gunn Svasti Na Ayudhya, Kritsanapoom Pibulsonggram, Keetapat Pongruea",Thailand,2020-03-05,2019,TV-MA,108 min,"Comedies, International Movies, LGBTQ Movies","After knocking a celebrity unconscious before a huge job, a bumbling pack of pals tries to avoid a lawsuit by replacing her with a look-alike."
s403,Movie,All About Love,Adze Ugah,"Chris Attoh, Katlego Danke, Enyinna Nwigwe, Nomzamo Mbatha, Richard Lukunku, Zenande Mfenyane, Leroy Gopal, Angela Sithole",South Africa,2020-03-06,2017,TV-MA,79 min,"Dramas, International Movies, Romantic Movies",An inseparable couple struggles to stay together when betrayal threatens to tear their lives apart.
s1582,Movie,Daffedar,Johnson Esthappan,"Tini Tom, Malavikka, Sudheer Karamana, Indrans",India,2018-07-01,2017,TV-14,151 min,"Dramas, International Movies","A retired government worker continues to dedicate himself to public service, but his principled ways soon clash with those of his extravagant sons."
s4405,TV Show,Naruto,Hayato Date,"Junko Takeuchi, Chie Nakamura, Noriaki Sugiyama, Kazuhiko Inoue, Toshihiko Seki, Hidekatsu Shibata, Masako Katsuki, Nana Mizuki",Japan,2019-09-01,2006,TV-14,9 Seasons,"Anime Series, International TV Shows","Guided by the spirit demon within him, orphaned Naruto learns to harness his powers as a ninja in this anime adventure series."
s7256,Movie,True: Wuzzle Wegg Day,"Todd Kauffman, Mark Thornton","Michela Luci, Jamie Watson, Eric Peterson, Anna Claire Bartlam, Nicolas Aqui, Cory Doran, Julie Lemieux",Canada,2020-03-27,2020,TV-Y,24 min,Children & Family Movies,"Spring has sprung in Rainbow City, and Wuzzle Wegg Day is right around the corner! But Bartleby's convinced that a Wegg-stealing monster is on the loose."
s38,Movie,#Selfie 69,Cristina Jacob,"Maia Morgenstern, Olimpia Melinte, Crina Semciuc, Flavia Hojda, Maria Dinulescu, Alex Calin, Vlad Logigan, Levent Sali, Silvia Busuioc, Mihaela Mihut",Romania,2019-06-01,2016,TV-MA,119 min,"Comedies, Dramas, International Movies","After a painful breakup, a trio of party-loving friends makes a bet: who can get married in three days."
s7177,Movie,Trailer Park Boys: Say Goodnight to the Bad Guys,Mike Clattenburg,"John Paul Tremblay, Robb Wells, John Dunsworth, Patrick Roach, Lucy Decoutere, Sarah Dunsworth, Barrie Dunn, Jeanna Harrison, Shelley Thompson, Tyrone Parsons",Canada,2018-03-01,2008,TV-MA,47 min,"Comedies, Cult Movies","A year after the Season 7 finale, the boys are poised to live the good life. But an old enemy throws a wrench in things once again."
s865,Movie,Between Two Ferns: The Movie,Scott Aukerman,"Zach Galifianakis, Lauren Lapkus, Ryan Gaul, Jiavani Linayao, Will Ferrell",United States,2019-09-20,2019,TV-MA,83 min,Comedies,"Armed with awkward questions and zero self-awareness, Zach Galifianakis hits the road to find famous interview subjects for his no-budget talk show."
s3120,TV Show,Jamtara - Sabka Number Ayega,Soumendra Padhi,"Amit Sial, Dibyendu Bhattacharya, Aksha Pardhasany, Sparsh Shrivastava, Monika Panwar, Anshumaan Pushkar",India,2020-01-10,2020,TV-MA,1 Season,"Crime TV Shows, International TV Shows, TV Dramas","A group of small-town young men run a lucrative phishing operation, until a corrupt politician wants in on their scheme – and a cop wants to fight it."
s6870,Movie,The Signal,"William Eubank, Will Eubank","Brenton Thwaites, Olivia Cooke, Laurence Fishburne, Beau Knapp, Lin Shaye, Robert Longstreet",United States,2018-07-13,2014,PG-13,97 min,"Sci-Fi & Fantasy, Thrillers","During their drive across the country, college pals Nick and Jonah – accompanied by Nick's girlfriend – run into major trouble in the Nevada desert."
s2334,Movie,Gad Gone Wild,Mario Rouleau,Gad Elmaleh,France,2017-01-23,2017,TV-MA,57 min,Stand-Up Comedy,French comic Gad Elmaleh regales a Montreal crowd with tales of awkward mix-ups and baffling customs he's encountered since moving to the U.S.
s2280,Movie,Freezer's Campaign,Sameh Abdulaziz,"Bayyumi Fuad, Chico, Hesham Maged, Ahmed Fathy, Nesreen Ameen, Dareen Haddad, Bushra, Samy Maghawry",Egypt,2019-06-06,2016,TV-MA,116 min,"Comedies, International Movies","When climate change makes Egypt freeze over, intelligence officers pose as a film crew on location to seek a device that can eliminate the frost."
s3562,Movie,LeapFrog: Phonics Farm,Ron Myrick,"Jeannie Elias, Kat Feller, Sandy Fox, Cindy Robinson, Richard Rosenblatt",United States,2020-04-15,2011,TV-Y,35 min,Movies,Scout takes a magical trip to a farm where an alligator and other friendly critters teach him all about sounding out the letters of the alphabet.
s7003,Movie,The Wishing Tree,Manika Sharma,"Shabana Azmi, Makrand Deshpande, Harshpreet Kaur, Aabhas Yadav, Shivani Joshi, Saurabh Shukla",India,2017-06-05,2017,TV-14,117 min,"Children & Family Movies, Dramas, Music & Musicals",Five children living on the edge of a forest band together to save a magical wishing tree from destruction and find their own paths to happiness.
s7505,Movie,We Belong Together,Chris Stokes,"Charles Malik Whitfield, Draya Michele, Elise Neal, Cassidey Fralin, Brian White, Valarie Pettiford, Gary Anthony Sturgis, Jessica Vanessa DeLeon",United States,2019-07-16,2018,TV-14,83 min,Thrillers,A divorced professor shares a night of passion with a troubled student who quickly develops an unhealthy – perhaps deadly – infatuation.
s5251,Movie,Rodney Carrington: Here Comes the Truth,Brandon Jones,Rodney Carrington,United States,2017-10-03,2017,TV-MA,66 min,Stand-Up Comedy,"Raunchy country comic and musician Rodney Carrington jokes and sings about life in his 40s, poking fun at sex, relationships and gaining weight."
s4650,Movie,One More Try,Ruel S. Bayani,"Angel Locsin, Angelica Panganiban, Dingdong Dantes, Zanjoe Marudo, Miguel Vergara, Gina Pareño, Carmina Villarroel, Agot Isidro",Philippines,2020-11-05,2012,TV-14,102 min,"Dramas, International Movies, Romantic Movies","When her son's condition becomes severe, a woman reconnects with the biological father. But the reunion puts a strain on their respective relationships."
s745,Movie,Barbie: Princess Charm School,Ezekiel Norton,"Diana Kaarina, Morwenna Banks, Nicole Oliver, Brittney Wilson, Ali Liebert, Shannon Chan-Kent, Madeleine Peters, Cathy Weseluck, Ellen Kennedy, Vincent Tong, Derek Waters, Brian Drummond, Tabitha St. Germain, Bethany Brown, Miranda Nolte, Kelly Metzger, Kazumi Evans, Anna Cummer","United States, Canada",2017-10-01,2011,TV-Y,80 min,Children & Family Movies,"Blair Willows is excited when she gets to go to Princess Charm School, where she meets princesses Delancy and Hadley, and searches for a magic crown."
s85,Movie,21 & Over,"Jon Lucas, Scott Moore","Miles Teller, Skylar Astin, Justin Chon, Sarah Wright, Jonathan Keltz, François Chau, Russell Hodgkinson, Daniel Booko, Russell Mercado, Josie Loren, Dustin Ybarra",United States,2019-04-16,2013,R,93 min,Comedies,Jeff's straight-and-narrow life changes abruptly when his buddies take him out for a birthday bash – the night before a crucial med school interview.
s5172,Movie,Results,Andrew Bujalski,"Guy Pearce, Cobie Smulders, Kevin Corrigan, Giovanni Ribisi, Anthony Michael Hall, Brooklyn Decker, Constance Zimmer, Tishuan Scott",United States,2015-10-22,2015,R,105 min,"Comedies, Independent Movies","After an ugly divorce, a wealthy but unhappy man trains at a local gym and develops a strange relationship with the owner and a captivating trainer."
s6081,Movie,The American President,Rob Reiner,"Michael Douglas, Annette Bening, Martin Sheen, Michael J. Fox, David Paymer, Samantha Mathis, John Mahoney, Anna Deavere Smith, Nina Siemaszko, Wendie Malick, Shawna Waldron, Richard Dreyfuss, Joshua Malina",United States,2021-01-01,1995,PG-13,113 min,"Comedies, Dramas, Romantic Movies",The widowed president strikes up a romance with a beautiful Washington lobbyist – but can the couple keep their private and political lives separate?
s6548,Movie,The Land of Steady Habits,Nicole Holofcener,"Ben Mendelsohn, Edie Falco, Connie Britton, Thomas Mann, Bill Camp, Elizabeth Marvel, Charlie Tahan, Michael Gaston, Josh Pais",United States,2018-09-14,2018,TV-MA,98 min,"Comedies, Dramas, Independent Movies","After leaving his wife and his job to find happiness, Anders begins a clumsy, heartbreaking quest to reassemble the pieces of his fractured life."
s6282,Movie,The Debt Collector,Jesse V. Johnson,"Scott Adkins, Louis Mandylor, Vladimir Kulich, Michael Paré, Rachel Brann, Selina Lo, Tony Todd","United Kingdom, United States",2018-09-03,2018,TV-MA,96 min,Action & Adventure,"A broke martial arts instructor takes a side gig with a mobster, who pairs him with a veteran thug for a weekend of fisticuffs-fueled debt collection."
s4834,Movie,Personal Shopper,Olivier Assayas,"Kristen Stewart, Lars Eidinger, Sigrid Bouaziz, Anders Danielsen Lie, Ty Olwin, Hammou Graïa, Nora von Waldstätten, Benjamin Biolay, Audrey Bonnet, Pascal Rambert","France, Germany, Czech Republic, Belgium",2019-02-01,2016,R,105 min,"Dramas, International Movies, Thrillers","A psychic medium takes a job as personal shopper for a spoiled celebrity in order to contact the spirit of her brother, who owned her employer's home."
s6544,Movie,The Lamb,Timothy Reckart,"Steven Yeun, Keegan-Michael Key, Aidy Bryant, Gina Rodriguez, Zachary Levi, Christopher Plummer, Ving Rhames, Gabriel Iglesias, Kelly Clarkson, Anthony Anderson, Patricia Heaton, Kris Kristofferson, Kristin Chenoweth, Mariah Carey, Oprah Winfrey, Tyler Perry, Tracy Morgan",United States,2018-06-04,2017,PG,86 min,"Children & Family Movies, Faith & Spirituality",A big-dreaming donkey escapes his menial existence and befriends some free-spirited animal pals in this imaginative retelling of the Nativity Story.
s2319,Movie,Furie,Le Van Kiet,"Ngo Thanh Van, Phan Thanh Nhien, Mai Cat Vi, Thanh Hoa, Pham Anh Khoa",Vietnam,2019-09-25,2019,TV-MA,97 min,"Action & Adventure, Dramas, International Movies","When traffickers kidnap her daughter from their village, vengeful Hai Phuong returns to Saigon – and her outlaw roots – to take down the abductors."
s5637,Movie,Siren,Gregg Bishop,"Chase Williamson, Hannah Fierman, Justin Welborn, Hayes Mercure, Michael Aaron Milligan, Brittany S. Hall, Randy McDowell, Lindsey Garrett, William Mark McCullough, Patrick Wood",United States,2020-01-01,2016,TV-MA,83 min,Horror Movies,A groom-to-be and his pals celebrate with a debauched night out that ends with a supernatural assault by a stripper who is not what she appears to be.
s1107,Movie,Bring It On: Worldwide Showdown,Robert Adetuyi,"Cristine Prosperi, Jordan Rodrigues, Gia Re, Sophie Vavasseur, Sven Ruygrok, Stephan Lee Benson, Natalie Walsh, Vivica A. Fox",United States,2017-08-29,2017,PG-13,95 min,Comedies,"When cheerleading champs the Rebels are challenged by an edgy new squad, they take on teams from all over the world in a virtual cheer battle."
s6573,Movie,The Last Whistle,Rob Smat,"Brad Leland, Jim O'Heir, Deanne Lauvin, Les Miles, Eric Nelsen, Fred Tolliver Jr, Tyler Perez, Sainty Nelsen",United States,2019-10-26,2019,PG,88 min,"Dramas, Sports Movies","After a star player dies during football practice, his coach’s career and reputation are on the line as he refuses to quit his win-at-all-costs style."
s2352,Movie,Gangs of New York,Martin Scorsese,"Leonardo DiCaprio, Daniel Day-Lewis, Cameron Diaz, Jim Broadbent, John C. Reilly, Henry Thomas, Liam Neeson, Brendan Gleeson, Gary Lewis, Stephen Graham","United States, Italy",2019-08-20,2002,R,167 min,Dramas,"In the crime-ridden slums of New York in the 1860s, vengeful orphan Amsterdam Vallon joins the cutthroat gang of his father's killer, Bill the Butcher."
s2491,Movie,Good Time,"Benny Safdie, Josh Safdie","Robert Pattinson, Benny Safdie, Jennifer Jason Leigh, Barkhad Abdi, Buddy Duress, Peter Verby, Taliah Webster, Necro",United States,2020-02-11,2017,R,101 min,"Dramas, Independent Movies, Thrillers","After spearheading an ill-fated bank robbery, a man must get his mentally challenged younger brother out of jail while eluding his own capture."
s7437,Movie,Vitti Dandu,Ganesh Kadam,"Dilip Prabhavalkar, Ashok Samarth, Yatin Karyekar, Nishant Bhavsar, Mrunal Thakur, Vikas Kadam, Utpal Sawant, Ravindra Mankani, Shubhankar Atre, Charudatta Bhagwat",India,2017-07-15,2014,TV-14,116 min,"Dramas, International Movies","In a remote village in colonial India, an old man and his grandson display strong differences in their attitudes toward the country's British rulers."
s4397,Movie,Namastey London,Vipul Amrutlal Shah,"Akshay Kumar, Katrina Kaif, Rishi Kapoor, Upen Patel, Javed Sheikh, Nina Wadia, Clive Standen, Tiffany Mulheron",India,2018-07-01,2007,TV-14,130 min,"Comedies, Dramas, International Movies","To her Indian parents' dismay, London-born Jasmeet ""Jazz"" Malhotra longs for everything Western, including her British boyfriend. On a family trip to India, her father arranges Jazz's nuptials to Arjun Ballu Singh, who's smitten with his new bride."
s1613,Movie,Dark Crimes,Alexandros Avranas,"Jim Carrey, Marton Csokas, Charlotte Gainsbourg, Agata Kulesza, Kati Outinen, Zbigniew Zamachowski, Danuta Kowalska, Vlad Ivanov, Robert Więckiewicz, Piotr Głowacki","United Kingdom, Poland, United States",2019-10-15,2016,R,93 min,"Dramas, Thrillers",A detective on a cold murder case discovers that a famous writer’s latest novel contains details chillingly similar to the crime he’s investigating.
s2533,Movie,Green Room,Jeremy Saulnier,"Anton Yelchin, Imogen Poots, Patrick Stewart, Alia Shawkat, Joe Cole, Callum Turner, Macon Blair, David W. Thompson, Mark Webber, Eric Edelstein, Kai Lennox",United States,2018-11-12,2015,R,95 min,"Horror Movies, Thrillers","At the end of their low-budget tour, a punk band accepts a gig at an isolated rural club, only to discover that their hosts are neo-Nazis."
s7260,Movie,Tu Hai Mera Sunday,Milind Dhaimade,"Barun Sobti, Shahana Goswami, Vishal Malhotra, Avinash Tiwary, Rasika Dugal, Maanvi Gagroo, Nakul Bhalla, Jay Upadhyay",India,2018-03-01,2016,TV-14,125 min,"Comedies, Independent Movies, International Movies","When their Sunday soccer game on the beach is canceled, five friends set out to find another place to play in the noisy, crowded city of Mumbai."
s6840,Movie,The Rugrats Movie,"Igor Kovalyov, Norton Virgien","Elizabeth Daily, Christine Cavanaugh, Kath Soucie, Melanie Chartoff, Phil Proctor, Cree Summer, Cheryl Chase, Tara Strong, Jack Riley, Joe Alaskey, Michael Bell, Tress MacNeille, Busta Rhymes, Whoopi Goldberg, David Spade",United States,2019-10-01,1998,G,81 min,"Children & Family Movies, Comedies","When his baby brother Dil is born, Tommy Pickles and his pals decide that he's too much responsibility and try to return him to the hospital."
s5395,Movie,Sarivar Sari,Gajendra Ahire,"Madhura Velankar, Mohan Joshi, Nina Kulkarni, Manasi Salvi, Milind Gunaji, Shreyas Talpade, Bharat Jadhav",India,2018-02-15,2005,TV-14,126 min,"Dramas, International Movies","Raised in working-class Mumbai, Manisha has an independent spirit that angers her father, who favors Manisha's medical student sister, Mini. Things reach a breaking point when Manisha's father beats her for accepting a modeling contract."
s2508,Movie,Goyo: The Boy General,Jerrold Tarog,"Paulo Avelino, Carlo Aquino, Arron Villaflor, Mon Confiado, Gwen Zamora, Jeffrey Quizon, Alvin Anson, Empress Schuck, Perla Bautista, Benjamin Alves",Philippines,2019-01-26,2018,TV-MA,150 min,"Dramas, International Movies","Brash ladies' man Gregorio ""Goyo"" del Pilar rises to become one of the Philippines' youngest generals in this historical epic sequel to ""Heneral Luna."""
s5524,Movie,Sex Drive,Sean Anders,"Josh Zuckerman, Amanda Crew, Clark Duke, Seth Green, James Marsden, Michael Cudlitz, Dave Sheridan, Alice Greczyn, Katrina Bowden, Charlie McDermott, Mark L. Young",United States,2020-09-01,2008,R,109 min,Comedies,"Eager to hook up with a woman he met online, 18-year-old Ian embarks on an epic road trip that speeds straight toward trouble in this raunchy comedy."
s4148,Movie,Mission Blue,"Robert Nixon, Fisher Stevens","James Cameron, Michael deGruy, Sylvia Earle, Bryce Groark, Jeremy Jackson, Carl Safina","United States, Bermuda, Ecuador",2014-08-15,2014,TV-PG,94 min,Documentaries,This documentary follows oceanographer Sylvia Earle's campaign to save the world's oceans from threats such as overfishing and toxic waste.
s6824,Movie,The Riot Club,Lone Scherfig,"Sam Claflin, Max Irons, Douglas Booth, Jessica Brown Findlay, Holliday Grainger, Natalie Dormer, Olly Alexander, Matthew Beard, Gordon Brown, Jack Farthing, Freddie Fox",United Kingdom,2017-03-16,2014,R,107 min,"Dramas, International Movies","After being drafted into an elite secret society, a pair of students at Oxford University see the group's extreme debauchery spiral out of control."
s501,Movie,Anaamika,Sekhar Kammula,"Nayantara, Vaibhav Reddy, Pasupathy, Harshvardhan Rane, Thagubothu Ramesh, Vinay Varma, Dheer Charan Srivastav, D. Narsingh Rao",India,2020-09-17,2014,TV-14,130 min,"International Movies, Thrillers","As a woman scours Hyderabad for her missing husband, she becomes entangled in a conspiracy that suggests there’s more to the mystery than meets the eye."
s743,Movie,Barbie Star Light Adventure,"Andrew Tan, Michael Goguen","Erica Lindbeck, Robbie Daymond, Kimberly Woods, Sarah Anne Williams, Michael Chandler, Dwight Schultz, Ben Bledsoe, Jonathan Lipow, Lucien Dodge, Laura Post",United States,2017-10-01,2016,TV-Y,79 min,Children & Family Movies,"A hoverboard-riding princess of the cosmos, Barbie must band together with a team of talented new friends to save the stars from winking out."
s1939,Movie,Ek Khiladi Ek Haseena,Suparn Verma,"Koena Mitra, Fardeen Khan, Kay Kay Menon, Mumait Khan, Rakhi Sawant, Feroz Khan, Zabyn Khan, Rohit Roy, Gulshan Grover, Amin Hajee",India,2019-04-15,2005,TV-14,141 min,"International Movies, Music & Musicals, Thrillers","Indebted to a gangster, a grifter assembles a band of fellow swindlers to attempt his biggest scam yet, but it's soon clear that no one can be trusted."
s7784,Movie,Zubaan,Mozez Singh,"Vicky Kaushal, Sarah-Jane Dias, Raaghav Chanana, Manish Chaudhary, Meghna Malik, Malkeet Rauni, Anita Shabdish, Chittaranjan Tripathy",India,2019-03-02,2015,TV-14,111 min,"Dramas, International Movies, Music & Musicals","A scrappy but poor boy worms his way into a tycoon's dysfunctional family, while facing his fear of music and the truth about his past."
s7401,TV Show,Velvet,Carlos Sedes,"Paula Echevarría, Miguel Ángel Silvestre, Aitana Sánchez-Gijón, Manuela Velasco, Manuela Vellés, Marta Hazas, Javier Rey, Maxi Iglesias, Cecilia Freire, Adrián Lastra, Miriam Giovanelli, Natalia Millán, José Sacristán, Ingrid Rubio, Peter Vives, Llorenç González, Ángela Molina, Pastora Vega",Spain,2020-03-04,2016,TV-14,4 Seasons,"International TV Shows, Romantic TV Shows, Spanish-Language TV Shows","In 1950s Spain, the heir to a fashion house romances a beautiful seamstress who works for the company, despite the objections of his family."
s1266,Movie,Chalte Chalte,Aziz Mirza,"Shah Rukh Khan, Rani Mukerji, Jas Arora, Satish Shah, Rajiv Verma, Lillete Dubey, Jayshree T., Johny Lever",India,2018-07-01,2003,TV-14,166 min,"Dramas, International Movies, Romantic Movies","Priya and Raj are polar opposites. Raj is brash and earthy, while Pirya is sophisticated and something of a perfectionist in all she does. They really are like oil and water, but nonetheless, they dare to fall in love."
s6163,Movie,The Bounty Hunter,Andy Tennant,"Jennifer Aniston, Gerard Butler, Jason Sudeikis, Jeff Garlin, Ritchie Coster, Cathy Moriarty, Peter Greene, Joel Marsh Garland, Siobhan Fallon Hogan, Dorian Missick, Adam Rose, Christine Baranski, Carol Kane, Adam LeFevre",United States,2019-10-01,2010,PG-13,111 min,"Action & Adventure, Comedies, Romantic Movies","Bounty hunter Milo Boyd finds his latest assignment downright satisfying as he learns that the bail-jumper he must chase down is his ex-wife, Nicole."
s5264,Movie,Romance Doll,Yuki Tanada,"Issey Takahashi, Yuu Aoi, Kenta Hamano, Toko Miura, Koji Ohkura, Pierre Taki, Eri Watanabe, Kitaro",Japan,2020-07-24,2020,TV-MA,124 min,"Dramas, International Movies, Romantic Movies","Love came naturally for married couple Sonoko and Tetsuo. But his secret profession as a love doll designer clashes with her deeper, darker secret."
s4117,Movie,Minimalism: A Documentary About the Important Things,Matt D'Avella,"Joshua Fields Millburn, Ryan Nicodemus",United States,2019-11-04,2016,TV-14,78 min,Documentaries,People dedicated to rejecting the American ideal that things bring happiness are interviewed in this documentary showing the virtues of less is more.
s5766,Movie,Splatter,Joe Dante,"Corey Feldman, Tony Todd, Tara Leigh, Erin Way, Mark Alan, Stuart Pankin",United States,2009-11-18,2009,TV-MA,29 min,Horror Movies,"After committing suicide, a washed-up rocker returns from the grave to torment the five people who betrayed him in life."
s1826,Movie,Doom: Annihilation,Tony Giglio,"Amy Manson, Dominic Mafham, Luke Allen-Gale, James Weber Brown, Clayton Adams, Nina Bergman, Amer Chadha-Patel, Gavin Brocker, Chidi Ajufo, Hari Dhillon, Katrina Nare",United States,2019-12-25,2019,R,97 min,"Action & Adventure, Horror Movies, Sci-Fi & Fantasy","When a swarm of soul-stealing demons invades a Martian moon, a group of elite space Marines must obliterate the beasts to save Earth."
s2863,Movie,Humko Deewana Kar Gaye,Raj Kanwar,"Akshay Kumar, Katrina Kaif, Bipasha Basu, Bhagyashree, Shernaz Patel, Vivek Shaq, Mahesh Thakur, Ranjeet, Nina Kulkarni, Puneet Issar, Anju Mahendru, Manoj Joshi, Anil Kapoor",India,2017-10-22,2006,TV-PG,149 min,"International Movies, Music & Musicals, Romantic Movies",Two kindred spirits who are betrothed to others must decide whether to go through with arranged marriages or brush aside convention for true love.
s2464,Movie,Gol Maal,Hrishikesh Mukherjee,"Amol Palekar, Bindiya Goswami, Deven Verma, Utpal Dutt, Shubha Khote, Manju Singh, Dina Pathak, Pushpa, David Abraham, Asrani",India,2019-12-31,1979,TV-PG,137 min,"Classic Movies, Comedies, International Movies","When circumstances at work compel Ram to pretend to have a twin, his lie works – until the boss wants his daughter to marry Ram’s fictitious brother."
